DX DESCRIPTION,CUI
"Localization-related (focal) (partial) symptomatic epilepsy and epileptic syndromes with simple partial seizures, intractable, with status epilepticus",C2875087
"Localization-related (focal) (partial) symptomatic epilepsy and epileptic syndromes with simple partial seizures, intractable, without status epilepticus",C2875088
"Localization-related (focal) (partial) symptomatic epilepsy and epileptic syndromes with complex partial seizures, not intractable, with status epilepticus",C2875092
"Localization-related (focal) (partial) symptomatic epilepsy and epileptic syndromes with complex partial seizures, not intractable, without status epilepticus",C2875093
"Localization-related (focal) (partial) symptomatic epilepsy and epileptic syndromes with complex partial seizures, intractable, with status epilepticus",C2875095
"Localization-related (focal) (partial) symptomatic epilepsy and epileptic syndromes with complex partial seizures, intractable, without status epilepticus",C2875096
"Generalized idiopathic epilepsy and epileptic syndromes, not intractable, with status epilepticus",C2875105
"Generalized idiopathic epilepsy and epileptic syndromes, not intractable, without status epilepticus",C2875106
"Generalized idiopathic epilepsy and epileptic syndromes, intractable, with status epilepticus",C2875108
"Generalized idiopathic epilepsy and epileptic syndromes, intractable, without status epilepticus",C2875109
"Other generalized epilepsy and epileptic syndromes, not intractable, with status epilepticus",C2875112
"Other generalized epilepsy and epileptic syndromes, not intractable, without status epilepticus",C2875113
"Other generalized epilepsy and epileptic syndromes, intractable, with status epilepticus",C2875115
"Other generalized epilepsy and epileptic syndromes, intractable, without status epilepticus",C2875116
Cyclin-Dependent Kinase-Like 5 Deficiency Disorder,C4750718
"Epileptic seizures related to external causes, not intractable, with status epilepticus",C3263969
"Epileptic seizures related to external causes, not intractable, without status epilepticus",C3263971
"Other epilepsy, not intractable, with status epilepticus",C2875132
"Other epilepsy, not intractable, without status epilepticus",C3263975
"Other epilepsy, intractable, with status epilepticus",C3263976
"Other epilepsy, intractable, without status epilepticus",C3263977
"Lennox-Gastaut syndrome, not intractable, with status epilepticus",C3263978
"Lennox-Gastaut syndrome, not intractable, without status epilepticus",C3263979
"Lennox-Gastaut syndrome, intractable, with status epilepticus",C3263980
"Lennox-Gastaut syndrome, intractable, without status epilepticus",C3263981
"Epileptic spasms, not intractable, with status epilepticus",C3263983
"Epileptic spasms, not intractable, without status epilepticus",C3263984
"Epileptic spasms, intractable, with status epilepticus",C3263985
"Epileptic spasms, intractable, without status epilepticus",C3263986
"Dravet syndrome, intractable, with status epilepticus",C5384687
"Dravet syndrome, intractable, without status epilepticus",C5384688
Other seizures,C2875137
"Epilepsy, unspecified, not intractable, with status epilepticus",C2875139
"Epilepsy, unspecified, not intractable, without status epilepticus",C2875140
"Epilepsy, unspecified, intractable, with status epilepticus",C2875142
"Epilepsy, unspecified, intractable, without status epilepticus",C2875143
"Absence epileptic syndrome, not intractable, with status epilepticus",C3263991
"Absence epileptic syndrome, not intractable, without status epilepticus",C3263992
"Absence epileptic syndrome, intractable, with status epilepticus",C3263994
"Absence epileptic syndrome, intractable, without status epilepticus",C3263995
"Juvenile myoclonic epilepsy, not intractable, with status epilepticus",C3263998
"Juvenile myoclonic epilepsy, not intractable, without status epilepticus",C3263999
"Juvenile myoclonic epilepsy, intractable, with status epilepticus",C3264001
"Juvenile myoclonic epilepsy, intractable, without status epilepticus",C3264002
Phantom limb syndrome with pain,C0031315|C3814878
Phantom limb syndrome without pain,C0452135
Guillain-Barre syndrome,C0018378|C4552840
Serum neuropathy,C0451648
Chronic inflammatory demyelinating polyneuritis,C0393819
Multifocal motor neuropathy,C0393847
Other inflammatory polyneuropathies,C0477393
"Inflammatory polyneuropathy, unspecified",C0477402
Drug-induced polyneuropathy,C0154762
Alcoholic polyneuropathy,C0085677
Polyneuropathy due to other toxic agents,C0154763
Critical illness polyneuropathy,C0393851
Radiation-induced polyneuropathy,C2875306
Polyneuropathy in diseases classified elsewhere,C0694477
Sequelae of Guillain-Barre syndrome,C2875308
Sequelae of other inflammatory polyneuropathy,C2875309
Sequelae of toxic polyneuropathy,C2875310
Myasthenia gravis without (acute) exacerbation,C1260409
Myasthenia gravis with (acute) exacerbation,C0270942
Toxic myoneural disorders,C0393939
Congenital and developmental myasthenia,C0451670
"Lambert-Eaton syndrome, unspecified",C3161080
Lambert-Eaton syndrome in disease classified elsewhere,C3250442
Other specified myoneural disorders,C0029816
"Myoneural disorder, unspecified",C0027868
"Muscular dystrophy, unspecified",C4554214
Duchenne or Becker muscular dystrophy,C4554215
Facioscapulohumeral muscular dystrophy,C0238288
Other specified muscular dystrophies,C4702817
Myotonic muscular dystrophy,C0027126
"Congenital myopathy, unspecified",C5539142
Nemaline myopathy,C0206157
X-linked myotubular myopathy,C0410203
Other centronuclear myopathy,C5384689
Other congenital myopathy,C5384690
Lambert-Eaton syndrome in neoplastic disease,C3161081
Myasthenic syndromes in other diseases classified elsewhere,C0477408
Spastic quadriplegic cerebral palsy,C0393995|C0837178
Spastic diplegic cerebral palsy,C0023882|C0270804
Spastic hemiplegic cerebral palsy,C0270805|C0837177
Athetoid cerebral palsy,C0270742
Ataxic cerebral palsy,C0394005
Other cerebral palsy,C0851216
"Cerebral palsy, unspecified",C0007789
Flaccid hemiplegia affecting unspecified side,C0154693
Flaccid hemiplegia affecting right dominant side,C2875326
Flaccid hemiplegia affecting left dominant side,C2875327
Flaccid hemiplegia affecting right nondominant side,C2875328
Flaccid hemiplegia affecting left nondominant side,C2875329
Spastic hemiplegia affecting unspecified side,C0154694
Spastic hemiplegia affecting right dominant side,C2875330
Spastic hemiplegia affecting left dominant side,C2875331
Spastic hemiplegia affecting right nondominant side,C2875332
Spastic hemiplegia affecting left nondominant side,C2875333
"Hemiplegia, unspecified affecting unspecified side",C0375218
"Hemiplegia, unspecified affecting right dominant side",C2875334
"Hemiplegia, unspecified affecting left dominant side",C2875335
"Hemiplegia, unspecified affecting right nondominant side",C2875336
"Hemiplegia, unspecified affecting left nondominant side",C2875337
"Paraplegia, unspecified",C0030486
"Paraplegia, complete",C1659098
"Paraplegia, incomplete",C1660761
"Quadriplegia, unspecified",C0034372
"Quadriplegia, C1-C4 complete",C2875339
"Quadriplegia, C1-C4 incomplete",C2875340
"Quadriplegia, C5-C7 complete",C2875341
"Quadriplegia, C5-C7 incomplete",C2875342
Diplegia of upper limbs,C0154701
Monoplegia of lower limb affecting unspecified side,C0375224
Monoplegia of lower limb affecting right dominant side,C2875344
Monoplegia of lower limb affecting left dominant side,C2875345
Monoplegia of lower limb affecting right nondominant side,C2875346
Monoplegia of lower limb affecting left nondominant side,C2875347
Monoplegia of upper limb affecting unspecified side,C0154703
Monoplegia of upper limb affecting right dominant side,C2875348
Monoplegia of upper limb affecting left dominant side,C2875349
Monoplegia of upper limb affecting right nondominant side,C2875350
Monoplegia of upper limb affecting left nondominant side,C2875351
"Monoplegia, unspecified affecting unspecified side",C2875352
"Monoplegia, unspecified affecting right dominant side",C2875353
"Monoplegia, unspecified affecting left dominant side",C2875354
"Monoplegia, unspecified affecting right nondominant side",C2875355
"Monoplegia, unspecified affecting left nondominant side",C2875356
Cauda equina syndrome,C0392548
Locked-in state,C0023944
Brown-Sequard syndrome,C0242644
Anterior cord syndrome,C0221069
Posterior cord syndrome,C0560650
Todd's paralysis (postepileptic),C2875358
Other specified paralytic syndromes,C0154706
"Paralytic syndrome, unspecified",C0270788
Familial dysautonomia [Riley-Day],C0013364
Multi-system degeneration of the autonomic nervous system,C2875366
Communicating hydrocephalus,C0009451
Obstructive hydrocephalus,C0549423
(Idiopathic) normal pressure hydrocephalus,C2047886
"Post-traumatic hydrocephalus, unspecified",C0477432
Hydrocephalus in diseases classified elsewhere,C2875379
Other hydrocephalus,C0477417
"Hydrocephalus, unspecified",C0020255
"Anoxic brain damage, not elsewhere classified",C0494514
Compression of brain,C0009592
Cerebral edema,C0006114
Reye's syndrome,C0035400
Syringomyelia and syringobulbia,C0039145
Acute infarction of spinal cord (embolic) (nonembolic),C2875385
Other vascular myelopathies,C2875387
Unspecified cord compression,C0037926
Other cord compression,C2875389
Conus medullaris syndrome,C0742803
Other specified diseases of spinal cord,C0477423
"Disease of spinal cord, unspecified",C0037928
Myelopathy in diseases classified elsewhere,C0477430
"Exudative age-related macular degeneration, right eye, stage unspecified",C4268377
"Exudative age-related macular degeneration, right eye, with active choroidal neovascularization",C4268378
"Exudative age-related macular degeneration, right eye, with inactive choroidal neovascularization",C4268379
"Exudative age-related macular degeneration, right eye, with inactive scar",C4268380
"Exudative age-related macular degeneration, left eye, stage unspecified",C4268381
"Exudative age-related macular degeneration, left eye, with active choroidal neovascularization",C4268382
"Exudative age-related macular degeneration, left eye, with inactive choroidal neovascularization",C4268383
"Exudative age-related macular degeneration, left eye, with inactive scar",C4268384
"Exudative age-related macular degeneration, bilateral, stage unspecified",C4268386
"Exudative age-related macular degeneration, bilateral, with active choroidal neovascularization",C4268387
"Exudative age-related macular degeneration, bilateral, with inactive choroidal neovascularization",C4268388
"Exudative age-related macular degeneration, bilateral, with inactive scar",C4268389
"Exudative age-related macular degeneration, unspecified eye, stage unspecified",C4268391
"Exudative age-related macular degeneration, unspecified eye, with active choroidal neovascularization",C4268392
"Exudative age-related macular degeneration, unspecified eye, with inactive choroidal neovascularization",C4268393
"Exudative age-related macular degeneration, unspecified eye, with inactive scar",C4268394
"Vitreous hemorrhage, unspecified eye",C0042909
"Vitreous hemorrhage, right eye",C2070032
"Vitreous hemorrhage, left eye",C2070033
"Vitreous hemorrhage, bilateral",C2881056
"Kearns-Sayre syndrome, right eye",C2881301
"Kearns-Sayre syndrome, left eye",C2881302
"Kearns-Sayre syndrome, bilateral",C2881303
"Kearns-Sayre syndrome, unspecified eye",C2881304
Rheumatic heart failure,C0155582
Hypertensive heart disease with heart failure,C1400066
Hypertensive chronic kidney disease with stage 5 chronic kidney disease or end stage renal disease,C2882078
"Hypertensive heart and chronic kidney disease with heart failure and stage 1 through stage 4 chronic kidney disease, or unspecified chronic kidney disease",C2882081
"Hypertensive heart and chronic kidney disease without heart failure, with stage 5 chronic kidney disease, or end stage renal disease",C2882085
"Hypertensive heart and chronic kidney disease with heart failure and with stage 5 chronic kidney disease, or end stage renal disease",C2882086
"Hypertensive heart and chronic kidney disease with heart failure and with stage 5 chronic kidney disease, or end stage renal disease",C2882086
Unstable angina,C0002965
Angina pectoris with documented spasm,C0235470
Other forms of angina pectoris,C0348588
"Angina pectoris, unspecified",C0002962
ST elevation (STEMI) myocardial infarction involving left main coronary artery,C2882091
ST elevation (STEMI) myocardial infarction involving left anterior descending coronary artery,C2882093
ST elevation (STEMI) myocardial infarction involving other coronary artery of anterior wall,C2882098
ST elevation (STEMI) myocardial infarction involving right coronary artery,C2882101
ST elevation (STEMI) myocardial infarction involving other coronary artery of inferior wall,C2882105
ST elevation (STEMI) myocardial infarction involving left circumflex coronary artery,C2882108
ST elevation (STEMI) myocardial infarction involving other sites,C2882118
ST elevation (STEMI) myocardial infarction of unspecified site,C2882120
Non-ST elevation (NSTEMI) myocardial infarction,C1561921
"Acute myocardial infarction, unspecified",C0155626
Myocardial infarction type 2,C4521180
Other myocardial infarction type,C4509201
Subsequent ST elevation (STEMI) myocardial infarction of anterior wall,C2882131
Subsequent ST elevation (STEMI) myocardial infarction of inferior wall,C3839202
Subsequent non-ST elevation (NSTEMI) myocardial infarction,C2882141
Subsequent ST elevation (STEMI) myocardial infarction of other sites,C2882152
Subsequent ST elevation (STEMI) myocardial infarction of unspecified site,C2882155
Hemopericardium as current complication following acute myocardial infarction,C0348865
Atrial septal defect as current complication following acute myocardial infarction,C0348866
Ventricular septal defect as current complication following acute myocardial infarction,C0340331
Rupture of cardiac wall without hemopericardium as current complication following acute myocardial infarction,C0348867
Rupture of chordae tendineae as current complication following acute myocardial infarction,C0349074
Rupture of papillary muscle as current complication following acute myocardial infarction,C3665604
"Thrombosis of atrium, auricular appendage, and ventricle as current complications following acute myocardial infarction",C0348876
Postinfarction angina,C1142492
Other current complications following acute myocardial infarction,C0348589
Acute coronary thrombosis not resulting in myocardial infarction,C2882160
Dressler's syndrome,C0152107
Other forms of acute ischemic heart disease,C0348590
"Acute ischemic heart disease, unspecified",C1510446
Atherosclerotic heart disease of native coronary artery with unstable angina pectoris,C2882163
Atherosclerotic heart disease of native coronary artery with angina pectoris with documented spasm,C2882164
Atherosclerotic heart disease of native coronary artery with other forms of angina pectoris,C2882165
Atherosclerotic heart disease of native coronary artery with unspecified angina pectoris,C2882168
"Atherosclerosis of coronary artery bypass graft(s), unspecified, with unstable angina pectoris",C2882174
"Atherosclerosis of coronary artery bypass graft(s), unspecified, with angina pectoris with documented spasm",C2882175
"Atherosclerosis of coronary artery bypass graft(s), unspecified, with other forms of angina pectoris",C2882176
"Atherosclerosis of coronary artery bypass graft(s), unspecified, with unspecified angina pectoris",C2882177
Atherosclerosis of autologous vein coronary artery bypass graft(s) with unstable angina pectoris,C2882179
Atherosclerosis of autologous vein coronary artery bypass graft(s) with angina pectoris with documented spasm,C2882180
Atherosclerosis of autologous vein coronary artery bypass graft(s) with other forms of angina pectoris,C2882181
Atherosclerosis of autologous vein coronary artery bypass graft(s) with unspecified angina pectoris,C2882182
Atherosclerosis of autologous artery coronary artery bypass graft(s) with unstable angina pectoris,C2882184
Atherosclerosis of autologous artery coronary artery bypass graft(s) with angina pectoris with documented spasm,C2882185
Atherosclerosis of autologous artery coronary artery bypass graft(s) with other forms of angina pectoris,C2882186
Atherosclerosis of autologous artery coronary artery bypass graft(s) with unspecified angina pectoris,C2882187
Atherosclerosis of nonautologous biological coronary artery bypass graft(s) with unstable angina pectoris,C2882189
Atherosclerosis of nonautologous biological coronary artery bypass graft(s) with angina pectoris with documented spasm,C2882190
Atherosclerosis of nonautologous biological coronary artery bypass graft(s) with other forms of angina pectoris,C2882191
Atherosclerosis of nonautologous biological coronary artery bypass graft(s) with unspecified angina pectoris,C2882192
Atherosclerosis of native coronary artery of transplanted heart with unstable angina,C2882194
Atherosclerosis of native coronary artery of transplanted heart with angina pectoris with documented spasm,C2882195
Atherosclerosis of native coronary artery of transplanted heart with other forms of angina pectoris,C2882196
Atherosclerosis of native coronary artery of transplanted heart with unspecified angina pectoris,C2882197
Atherosclerosis of bypass graft of coronary artery of transplanted heart with unstable angina,C2882199
Atherosclerosis of bypass graft of coronary artery of transplanted heart with angina pectoris with documented spasm,C2882200
Atherosclerosis of bypass graft of coronary artery of transplanted heart with other forms of angina pectoris,C2882201
Atherosclerosis of bypass graft of coronary artery of transplanted heart with unspecified angina pectoris,C2882202
Atherosclerosis of other coronary artery bypass graft(s) with unstable angina pectoris,C2882204
Atherosclerosis of other coronary artery bypass graft(s) with angina pectoris with documented spasm,C2882205
Atherosclerosis of other coronary artery bypass graft(s) with other forms of angina pectoris,C2882206
Atherosclerosis of other coronary artery bypass graft(s) with unspecified angina pectoris,C2882207
Septic pulmonary embolism with acute cor pulmonale,C2882217
Septic pulmonary embolism with acute cor pulmonale,C2882217
Saddle embolus of pulmonary artery with acute cor pulmonale,C3264366
Saddle embolus of pulmonary artery with acute cor pulmonale,C3264366
Other pulmonary embolism with acute cor pulmonale,C2882218
Other pulmonary embolism with acute cor pulmonale,C2882218
Septic pulmonary embolism without acute cor pulmonale,C2882220
Saddle embolus of pulmonary artery without acute cor pulmonale,C3264367
Single subsegmental pulmonary embolism without acute cor pulmonale,C5140808
Multiple subsegmental pulmonary emboli without acute cor pulmonale,C5140809
Other pulmonary embolism without acute cor pulmonale,C2882222
Primary pulmonary hypertension,C0152171|C3203102
Kyphoscoliotic heart disease,C0152102
"Pulmonary hypertension, unspecified",C4509208
Secondary pulmonary arterial hypertension,C3665995
Pulmonary hypertension due to left heart disease,C3532326
Pulmonary hypertension due to lung diseases and hypoxia,C4509212
Chronic thromboembolic pulmonary hypertension,C2363973
Other secondary pulmonary hypertension,C2882223
Cor pulmonale (chronic),C1535090
Chronic pulmonary embolism,C0856722
Eisenmenger's syndrome,C0013743
Other specified pulmonary heart diseases,C0348595
"Pulmonary heart disease, unspecified",C0034072
Arteriovenous fistula of pulmonary vessels,C0155675
Aneurysm of pulmonary artery,C0155676
Other diseases of pulmonary vessels,C0348596
"Disease of pulmonary vessels, unspecified",C0178272
Dilated cardiomyopathy,C0007193|C2984282
Obstructive hypertrophic cardiomyopathy,C4551472
Other hypertrophic cardiomyopathy,C0348615
Endomyocardial (eosinophilic) disease,C0264834
Endocardial fibroelastosis,C0014117
Other restrictive cardiomyopathy,C0348616
Alcoholic cardiomyopathy,C0007192
Cardiomyopathy due to drug and external agent,C2882253
Other cardiomyopathies,C0348617
"Cardiomyopathy, unspecified",C0878544
Cardiomyopathy in diseases classified elsewhere,C0694499
"Atrioventricular block, complete",C0151517
Cardiac arrest due to underlying cardiac condition,C2882263
Cardiac arrest due to other underlying condition,C2882264
"Cardiac arrest, cause unspecified",C2882265
Re-entry ventricular arrhythmia,C0349069
Supraventricular tachycardia,C0039240|C1963244|C3815188
Ventricular tachycardia,C0042514|C0344428|C1963247|C2108113|C4554446
"Paroxysmal tachycardia, unspecified",C0039236
Paroxysmal atrial fibrillation,C0235480|C4050122
Longstanding persistent atrial fibrillation,C3873617
Other persistent atrial fibrillation,C5140810
"Chronic atrial fibrillation, unspecified",C0694539
Permanent atrial fibrillation,C2586056
Typical atrial flutter,C3264370
Atypical atrial flutter,C3264372
Unspecified atrial fibrillation,C3264374
Unspecified atrial flutter,C3264375
Ventricular fibrillation,C0042510|C0344435|C1962976|C2108112|C4554001
Ventricular flutter,C0152173|C1963276|C3812283
Junctional premature depolarization,C0428981
Sick sinus syndrome,C0037052|C1963235
"Left ventricular failure, unspecified",C4509222
Unspecified systolic (congestive) heart failure,C1135191
Acute systolic (congestive) heart failure,C4083073
Chronic systolic (congestive) heart failure,C1135194
Acute on chronic systolic (congestive) heart failure,C2733492
Unspecified diastolic (congestive) heart failure,C1135196
Acute diastolic (congestive) heart failure,C2215111
Chronic diastolic (congestive) heart failure,C2711480
Acute on chronic diastolic (congestive) heart failure,C2732749
Unspecified combined systolic (congestive) and diastolic (congestive) heart failure,C2882273
Acute combined systolic (congestive) and diastolic (congestive) heart failure,C2882274
Chronic combined systolic (congestive) and diastolic (congestive) heart failure,C2882275
Acute on chronic combined systolic (congestive) and diastolic (congestive) heart failure,C2882276
"Right heart failure, unspecified",C4509230
Acute right heart failure,C0264715
Chronic right heart failure,C4509234
Acute on chronic right heart failure,C4509237
Right heart failure due to left heart failure,C4509242
Biventricular heart failure,C0685095
High output heart failure,C0221045
End stage heart failure,C1868938
Other heart failure,C4509229
"Heart failure, unspecified",C0018801
"Rupture of chordae tendineae, not elsewhere classified",C0494599
"Rupture of papillary muscle, not elsewhere classified",C0494600
"Myocarditis, unspecified",C0027059
Myocardial degeneration,C0027046
Nontraumatic subarachnoid hemorrhage from unspecified carotid siphon and bifurcation,C2882290
Nontraumatic subarachnoid hemorrhage from right carotid siphon and bifurcation,C2882291
Nontraumatic subarachnoid hemorrhage from left carotid siphon and bifurcation,C2882292
Nontraumatic subarachnoid hemorrhage from unspecified middle cerebral artery,C2882294
Nontraumatic subarachnoid hemorrhage from right middle cerebral artery,C2882295
Nontraumatic subarachnoid hemorrhage from left middle cerebral artery,C2882296
Nontraumatic subarachnoid hemorrhage from anterior communicating artery,C2882297
Nontraumatic subarachnoid hemorrhage from unspecified posterior communicating artery,C2882302
Nontraumatic subarachnoid hemorrhage from right posterior communicating artery,C2882303
Nontraumatic subarachnoid hemorrhage from left posterior communicating artery,C2882304
Nontraumatic subarachnoid hemorrhage from basilar artery,C2882305
Nontraumatic subarachnoid hemorrhage from unspecified vertebral artery,C2882307
Nontraumatic subarachnoid hemorrhage from right vertebral artery,C2882308
Nontraumatic subarachnoid hemorrhage from left vertebral artery,C2882309
Nontraumatic subarachnoid hemorrhage from other intracranial arteries,C2882310
Nontraumatic subarachnoid hemorrhage from unspecified intracranial artery,C2882315
Other nontraumatic subarachnoid hemorrhage,C2882316
"Nontraumatic subarachnoid hemorrhage, unspecified",C1410400
"Nontraumatic intracerebral hemorrhage in hemisphere, subcortical",C1390194
"Nontraumatic intracerebral hemorrhage in hemisphere, cortical",C1390193
"Nontraumatic intracerebral hemorrhage in hemisphere, unspecified",C2882320
Nontraumatic intracerebral hemorrhage in brain stem,C1401193
Nontraumatic intracerebral hemorrhage in cerebellum,C1401192
"Nontraumatic intracerebral hemorrhage, intraventricular",C2882321
"Nontraumatic intracerebral hemorrhage, multiple localized",C2882322
Other nontraumatic intracerebral hemorrhage,C2882323
"Nontraumatic intracerebral hemorrhage, unspecified",C3662030
"Nontraumatic subdural hemorrhage, unspecified",C0265080
Nontraumatic acute subdural hemorrhage,C0494607
Nontraumatic subacute subdural hemorrhage,C2882326
Nontraumatic chronic subdural hemorrhage,C2882327
Nontraumatic extradural hemorrhage,C1318552
"Nontraumatic intracranial hemorrhage, unspecified",C0494608
Cerebral infarction due to thrombosis of unspecified precerebral artery,C2882329
Cerebral infarction due to thrombosis of right vertebral artery,C2882331
Cerebral infarction due to thrombosis of left vertebral artery,C2882332
Cerebral infarction due to thrombosis of bilateral vertebral arteries,C4268475
Cerebral infarction due to thrombosis of unspecified vertebral artery,C2882333
Cerebral infarction due to thrombosis of basilar artery,C2882334
Cerebral infarction due to thrombosis of right carotid artery,C2882336
Cerebral infarction due to thrombosis of left carotid artery,C2882337
Cerebral infarction due to thrombosis of bilateral carotid arteries,C4268476
Cerebral infarction due to thrombosis of unspecified carotid artery,C2882338
Cerebral infarction due to thrombosis of other precerebral artery,C2882339
Cerebral infarction due to embolism of unspecified precerebral artery,C2882340
Cerebral infarction due to embolism of right vertebral artery,C2882342
